{
  "schema_version": "0.1.0",
  "x-stability": "provisional",
  "matrix_id": "stage8-agent-cli-capability-matrix",
  "review_date": "2026-05-22",
  "candidate_boundary": "In-scope candidates are named coding-agent or CLI host surfaces with install or discovery mechanisms, agent-facing extension points, repository workspace access, and a CLI invocation or bootstrap path. IDE-only, CI-only, and hosted review surfaces are future evidence only and cannot be Stage 9 targets in this slug.",
  "capability_dimensions": [
    "agent_cli_install_distribution",
    "cli_bundling_bootstrap",
    "filesystem_access",
    "cli_invocation",
    "cli_report_rendering",
    "annotation_apis",
    "background_runs",
    "repair_action_ui",
    "trace_deep_links"
  ],
  "hosts": [
    {
      "schema_version": "0.1.0",
      "x-stability": "provisional",
      "capability_id": "github-copilot-cli-stage8",
      "host": {
        "id": "github-copilot-cli",
        "name": "GitHub Copilot CLI",
        "vendor": "GitHub"
      },
      "surface_kind": "agent-cli-marketplace-plugin",
      "candidate_status": "in-scope-candidate",
      "tier": "limited-adapter",
      "distribution_surface": "agent-cli-marketplace",
      "cli_management_modes": ["repo-pinned", "bootstrap", "user-installed"],
      "capabilities": {
        "agent_cli_install_distribution": {
          "status": "yes",
          "fallback": "supported",
          "evidence_ids": ["github-copilot-cli-install"],
          "note": "Copilot CLI has documented install paths and plugin marketplace sources."
        },
        "cli_bundling_bootstrap": {
          "status": "yes",
          "fallback": "supported",
          "evidence_ids": ["github-copilot-cli-bootstrap"],
          "note": "Pinned installs, custom homes, plugin directories, and local marketplaces support deterministic bootstrap."
        },
        "filesystem_access": {
          "status": "yes",
          "fallback": "supported",
          "evidence_ids": ["github-copilot-cli-filesystem"],
          "note": "Read, write, and shell tool grants can operate in trusted directories with scoped path filters."
        },
        "cli_invocation": {
          "status": "yes",
          "fallback": "supported",
          "evidence_ids": ["github-copilot-cli-invocation"],
          "note": "Programmatic prompt mode and tool allow/deny flags support scripted CLI invocation."
        },
        "cli_report_rendering": {
          "status": "yes",
          "fallback": "supported",
          "evidence_ids": ["github-copilot-cli-report"],
          "note": "Silent stdout, Markdown transcript export, Gist export, and GitHub Actions summaries can surface CLI reports."
        },
        "annotation_apis": {
          "status": "partial",
          "fallback": "advisory-only",
          "evidence_ids": ["github-copilot-cli-hooks"],
          "note": "Hooks can approve, deny, or inject context, but no public REST/event-bus annotation API is documented."
        },
        "background_runs": {
          "status": "yes",
          "fallback": "supported",
          "evidence_ids": ["github-copilot-cli-autopilot"],
          "note": "Autopilot, fleet subagents, session ids, and CI examples support background or unattended runs."
        },
        "repair_action_ui": {
          "status": "yes",
          "fallback": "supported",
          "evidence_ids": ["github-copilot-cli-repair"],
          "note": "Plan mode, permission prompts, rollback snapshots, and remote approvals support repair preview and approval flows."
        },
        "trace_deep_links": {
          "status": "partial",
          "fallback": "cli-redirect",
          "evidence_ids": ["github-copilot-cli-trace"],
          "note": "Share Gists and remote session URLs exist, but no structured per-step trace deep-link API is documented."
        }
      },
      "evidence": [
        {
          "evidence_id": "github-copilot-cli-install",
          "source": "https://docs.github.com/en/copilot/how-tos/copilot-cli/set-up-copilot-cli/install-copilot-cli",
          "accessed_date": "2026-05-22",
          "source_type": "official-docs",
          "finding": "positive",
          "note": "Install docs list npm, winget, Homebrew, install script, and binary release paths."
        },
        {
          "evidence_id": "github-copilot-cli-bootstrap",
          "source": "https://docs.github.com/en/copilot/how-tos/copilot-cli/set-up-copilot-cli/install-copilot-cli",
          "source_date": "2026-05-18",
          "accessed_date": "2026-05-22",
          "source_type": "official-docs",
          "finding": "positive",
          "note": "Install and release evidence covers pinned versions, COPILOT_HOME, plugin-dir controls, and local marketplace bootstrap."
        },
        {
          "evidence_id": "github-copilot-cli-filesystem",
          "source": "https://docs.github.com/en/copilot/reference/copilot-cli-reference/cli-programmatic-reference",
          "accessed_date": "2026-05-22",
          "source_type": "official-docs",
          "finding": "positive",
          "note": "Programmatic reference documents read, write, shell, trusted directories, --add-dir, and path-scoped tool filters."
        },
        {
          "evidence_id": "github-copilot-cli-invocation",
          "source": "https://docs.github.com/en/copilot/how-tos/copilot-cli/automate-copilot-cli/run-cli-programmatically",
          "accessed_date": "2026-05-22",
          "source_type": "official-docs",
          "finding": "positive",
          "note": "Programmatic invocation supports prompts, stdin, no-ask mode, tool filters, model/agent selection, and secret env vars."
        },
        {
          "evidence_id": "github-copilot-cli-report",
          "source": "https://docs.github.com/en/copilot/how-tos/copilot-cli/automate-copilot-cli/automate-with-actions",
          "accessed_date": "2026-05-22",
          "source_type": "official-docs",
          "finding": "positive",
          "note": "Automation docs show captured output and Markdown summaries suitable for report rendering."
        },
        {
          "evidence_id": "github-copilot-cli-hooks",
          "source": "https://docs.github.com/en/copilot/concepts/agents/hooks",
          "source_date": "2026-05-20",
          "accessed_date": "2026-05-22",
          "source_type": "official-docs",
          "finding": "partial",
          "note": "Hooks provide structured feedback injection, but no dedicated annotation persistence API is documented."
        },
        {
          "evidence_id": "github-copilot-cli-autopilot",
          "source": "https://docs.github.com/en/copilot/concepts/agents/copilot-cli/autopilot",
          "accessed_date": "2026-05-22",
          "source_type": "official-docs",
          "finding": "positive",
          "note": "Autopilot and fleet capabilities support unattended and parallel work."
        },
        {
          "evidence_id": "github-copilot-cli-repair",
          "source": "https://docs.github.com/en/copilot/concepts/agents/copilot-cli/cancel-and-roll-back",
          "accessed_date": "2026-05-22",
          "source_type": "official-docs",
          "finding": "positive",
          "note": "Rollback snapshots, plan approval, permission dialogs, and remote approvals support repair workflows."
        },
        {
          "evidence_id": "github-copilot-cli-trace",
          "source": "https://docs.github.com/en/copilot/how-tos/copilot-cli/automate-copilot-cli/run-cli-programmatically",
          "accessed_date": "2026-05-22",
          "source_type": "official-docs",
          "finding": "partial",
          "note": "Share URLs exist for transcripts, but formal item-level trace deep links are not documented."
        }
      ],
      "stage9_consequence": "proceed-limited-adapter",
      "stage9_scope_summary": "Proceed with a limited GitHub Copilot CLI adapter over plugin commands/hooks/MCP/skills; label annotation and trace deep-link UX as advisory or unavailable until formal APIs exist."
    },
    {
      "schema_version": "0.1.0",
      "x-stability": "provisional",
      "capability_id": "openai-codex-cli-stage8",
      "host": {
        "id": "openai-codex-cli",
        "name": "OpenAI Codex CLI",
        "vendor": "OpenAI"
      },
      "surface_kind": "agent-cli-command",
      "candidate_status": "in-scope-candidate",
      "tier": "limited-adapter",
      "distribution_surface": "package-registry",
      "cli_management_modes": ["repo-pinned", "bootstrap", "user-installed"],
      "capabilities": {
        "agent_cli_install_distribution": {
          "status": "yes",
          "fallback": "supported",
          "evidence_ids": ["openai-codex-cli-install"],
          "note": "Codex CLI has npm, Homebrew, static binary, and GitHub Action install paths."
        },
        "cli_bundling_bootstrap": {
          "status": "yes",
          "fallback": "supported",
          "evidence_ids": ["openai-codex-cli-bootstrap"],
          "note": "The npm bin, environment auth, CODEX_HOME, and static archives support deterministic bootstrap."
        },
        "filesystem_access": {
          "status": "yes",
          "fallback": "supported",
          "evidence_ids": ["openai-codex-cli-filesystem"],
          "note": "Sandbox modes and additional directory controls provide repository filesystem access."
        },
        "cli_invocation": {
          "status": "yes",
          "fallback": "supported",
          "evidence_ids": ["openai-codex-cli-invocation"],
          "note": "Noninteractive exec mode supports CI-safe invocation and command policies."
        },
        "cli_report_rendering": {
          "status": "yes",
          "fallback": "supported",
          "evidence_ids": ["openai-codex-cli-report"],
          "note": "JSONL streams, final-message output, and output schemas can render or validate reports."
        },
        "annotation_apis": {